{"attestation":{"integrity":"PASS","provenance_sha256":null,"subject_membership":"ABSENT"},"binding_assurance":"OFFICIAL_PUBLICATION_EXACT_BYTES","binding_id":"sentencepiece-windows-release-v0.2.1-production","binding_method":"OFFICIAL_RELEASE_ASSET_BYTE_IDENTITY","binding_record_sha256":"4f59550204a4befdfa3eeb96f8cc07452c520d2630f40939170c01bb0aec3cb8","covered_subject":{"artifact_type":"PYTHON_WHEEL","filename":"sentencepiece-0.2.1-cp313-cp313-win_amd64.whl","package":"sentencepiece","sha256":"10ed3dab2044c47f7a2e7b4969b0c430420cdd45735d78c8f853191fa0e3148b","version":"0.2.1"},"schema_version":"1","upstream_release":{"commit_signature":"VERIFIED","license_path":"sentencepiece-0.2.1/sentencepiece/LICENSE","license_sha256":"cfc7749b96f63bd31c3c42b5c471bf756814053e847c10f3eb003417bc523d30","release_asset_filename":"sentencepiece-0.2.1-cp313-cp313-win_amd64.whl","release_asset_sha256":"10ed3dab2044c47f7a2e7b4969b0c430420cdd45735d78c8f853191fa0e3148b","release_commit":"31646a467d2051eb904e0b45de3a73e91fe1c1e3","release_membership":"PASS","release_membership_evidence_sha256":"8187de6f0011ec82346a57500aa7c5dac769f520abeafbee98738571a8db04b2","release_tag":"v0.2.1","repository":"https://github.com/google/sentencepiece","source_archive_sha256":"8138cec27c2f2282f4a34d9a016e3374cd40e5c6e9cb335063db66a0a3b71fad"}}
